,title,url,created_time,tag_text,tag_url,article_text
9,Paris Masters: Rafael Nadal out with injury & Roger Federer through - BBC Sport,http://www.bbc.com///sport/tennis/46042799,,Tennis,http://www.bbc.com///sport/tennis,"Rafael Nadal has withdrawn from the Paris Masters with an abdominal injury. It means Novak Djokovic, 31, will replace him as world number one when the rankings are released on Monday. The Serb will lead the rankings for the first time in two years, with Briton Andy Murray having taken top spot from him in Paris in November 2016. Earlier on Wednesday, world number three Roger Federer made it through to the last 16 without playing when Milos Raonic pulled out with an elbow injury. Djokovic, a 14-time Grand Slam champion, was ranked 21st going into this year's Wimbledon and will become the first player to be outside the world's top 20 and the world number one in the same season since Russia's Marat Safin in 2000. Spaniard Nadal, 32, was due to make his comeback after nearly two months out with a knee injury that led to him retiring from his US Open semi-final. ""I felt better than I thought I would one week ago but in the last few days I started to feel a bit in my abdominal, especially when I was serving,"" the French Open champion said.  ""I checked with the doctor and the doctor recommended that I did not play. ""It has been a tough year for me in terms of injury so I want to avoid drastic things. ""I have to think longer term. I want to keep playing tennis for a couple of years, so I have to do the logical thing."" The Spaniard has not made any decisions yet about whether he will play at the season-ending ATP Finals in London in November. Nadal's scheduled Paris opponent, 34-year-old Fernando Verdasco, will play Jack Sock in the next round after the American beat France's Richard Gasquet 6-3 6-3. Earlier, Kei Nishikori had a straightforward 7-5 6-4 victory over Adrian Mannarino and John Isner served up 33 aces as he beat Mikhail Kukushkin 6-3 6-7 (2-7) 7-6 (7-1).  Japanese 28-year-old Nishikori did not face a single break point as he defeated home crowd favourite Mannarino in one hour and 27 minutes to progress.  He will meet seventh seed Kevin Anderson or Georgian Nikoloz Basilashvili in the next round. On Court One, Isner's powerful serving ensured he was not broken at all but wasted opportunities meant he struggled to get past Kazakh Kukushkin. The American's serve only let him down at the second-set tie-break, as the world number 54 forced a deciding set. That went the distance too but this was a different story for Isner, who won early points against the Kazakh's serve to take the match. Isner needs to reach the semi-finals in Paris to have any hope of moving up to ninth in the rankings, which would give him a chance of making the ATP Finals. Later on Wednesday, Alexander Zverev beat Frenchman Frances Tiafoe 6-4 6-4. The pair traded missed break points in first set before the German, 21, won the final game on Tiafoe's serve. In the second set, Zverev broke three times but was broken twice as he wrapped up the eventful match in one hour and 44 minutes. Ninth seed Grigor Dimitrov is also through after beating Roberto Bautista Agut 7-6 (12-10) 6-4. BBC tennis correspondent Russell Fuller There is, as ever, huge sympathy for Nadal, who has this year missed nine events for a combination of ailments, and pulled out of a Grand Slam quarter-final and semi-final. He always does everything he can to compete at London's end-of-season ATP Finals, as he is acutely aware of how many he has missed. Last year he played through pain against David Goffin, before withdrawing from the tournament. Maybe this year he would be better to rest. Two years ago here in Paris, Djokovic lost to Marin Cilic in the quarter-finals and Andy Murray took the opportunity to replace him as world number one. The Serb's return to the top is a remarkable achievement when you consider his stunning defeat by Marco Cecchinato in the French Open quarter-finals. Djokovic then went hiking in the mountains with his wife Jelena, which seemed to clear his head. The world number 21 heading into Wimbledon, he has only lost once since and seems almost certain to be year-end number one for a fifth time."
10,Copa del Rey: Clement Lenglet heads in late Barcelona winner at third-tier Cultural Leonesa - BBC Sport,http://www.bbc.com///sport/football/46052818,,European Football,http://www.bbc.com///sport/football/european,"Barcelona needed an injury-time winner from Clement Lenglet to edge past third division side Cultural Leonesa in the first leg of their Copa del Rey tie. The last-32 game looked set to be a goalless draw, but French defender Lenglet headed home his first Barca goal from Ousmane Dembele's free-kick. Barca, winners of the cup for the last four seasons, saw midfielder Sergi Samper limp off in the first half. The second leg takes place at the Nou Camp on 5 December."
11,An exclusive look at Sicily's bizarre mummy rituals - BBC Reel,https://www.bbc.com/reel/video/p06q8j6z/an-exclusive-visit-to-the-world-s-only-mummy-school,,Reel,https://www.bbc.com/reel,"Until now, Sicilian mummies were largely ignored."
12,The world’s most densely populated isle - BBC Reel,https://www.bbc.com/reel/playlist/islands?vpid=p060m8zv,,Reel,https://www.bbc.com/reel,Five hundred people live in 115 houses on an area the size of a soccer field
13,The man with an ‘infectious disease’ for collecting - BBC Reel,https://www.bbc.com/reel/video/p065ztwz/the-man-with-an-infectious-disease-for-collecting,,Reel,https://www.bbc.com/reel/,"From shrunken heads to mummified mermaids, is this the world’s strangest museum?"
14,World's longest DNA sequence decoded - BBC News,http://www.bbc.com///news/science-environment-46046024,2018-11-01 02:47:00,Science & Environment,http://www.bbc.com///news/science_and_environment,"A team of UK scientists have claimed the record for decoding the world's longest DNA sequence. The scientists produced a DNA read that is about 10,000 times longer than normal, and twice as large as a previous record holder, from Australia. This research has kick-started an Ashes-style competition to sequence an entire chromosome in a single read.  The new holder of the trophy for world's longest DNA read is a team led by Matt Loose at Nottingham University.  The advance is a technological one - this is about reading the DNA rather than the discovery of a particularly large genome. The DNA used for the long read came from a human. But the scientists hope the work will make it quicker and easier to sequence genetic information because, currently, DNA has to be chopped up into smaller pieces and then reassembled during the process of sequencing. Dr Loose's group also recently produced the most complete human genome sequence using a palm-sized ""nanopore"" sequencing machine. These potentially offer lower cost and faster processing for DNA sequencing. He told me: ""There has been a competition running to see who can get the longest sequence. I think it is still friendly.""  Dr Loose went on to say: ""Australia led for a while, but then we had a read just short of a million. People were then competing to beat the record, in particular to be the first person to get a million-base-pair read.  ""The friendly completion launched an Ashes style trophy that is supposed to travel around the world as people get the longest read."" An Australian team from the Kinghorn Centre for Clinical Genomics was first to pass the million-base milestone. The technology that enables scientists to read runs of DNA sequences has come a long way since the millennium-era race to decode the first human genome.  In the past 10 or so years, improvements in DNA sequencing technologies have meant that the original billion dollar human genome from 2001 can now be replicated for around $1000.  As costs continue to tumble, there is an expectation that personalised DNA sequencing is not far away. We might soon have our genome decoded during a trip to the doctor's surgery, or more controversially, our parents might have it read for us, before we are even born.  But one of the remaining stumbling blocks is to put the DNA pieces together in the correct order. Just as it is theoretically possible, but quite unlikely, that a chimpanzee might reproduce a work of Shakespeare with one finger typing, computer programs are unable to re-assemble genomes from short, jumbled DNA sequences.  Dr Loose told me: ""There are lots of ways by which you can read DNA, but the problem is that the genetic code, or genome, is often many billions of bases, and so to read them all is very difficult.  ""People have used many different ways in the past, but essentially what they do is chop the DNA up into small pieces and then assemble them back together, a bit like what you would do with a jigsaw puzzle.  ""You try to get overlapping images so that you can find where the sky is and where the trees are and you can build your picture."" He explained: ""Nanopore sequencing promised lower cost and higher read lengths which means that we can look at interesting organisms which are yet to be sequenced, because their genomes are extraordinarily large."" Just as the scientists are competing to produce the longest DNA sequence, the technology companies are jostling to become market-leaders in delivering these new advances.  In the future, these methods promise to both revolutionise the understanding of human health, and also bring the same methods to other plants and animals. Long-read DNA sequencing might be used to identify pathogens in foodstuffs, be employed in disease control in animals, used for the diagnosis of infection, and find uses in a vast number of food-related areas. I asked Dr Loose about the excited references to ""whale-watching"" on social media.  ""We wanted a way of distinguishing long reads. What does 'long' mean? It used to mean reads of 300 bases instead of 150, then it meant 5,000. So we came up with the whale scale - a million base pair read would be equivalent to a whale of about a tonne in weight, like a narwhal.  ""The longest read that we have at the moment is a beluga whale"".  I asked him how long it will be before we have a ""blue whale"" read from a whole chromosome. Matt told me: ""It would be fantastic to sequence a whole chromosome, if that is possible. If we scale the nanopore up to the size of a human fist, then a megabase of DNA is a rope of 3.2 km, which you have to thread through your fingers without it getting tangled or breaking.  ""There is also a really interesting question of how many breaks each chromosome has. I am not sure you will ever be able to sequence a chromosome from one end to the other. Dr Loose said of the record-breaking read: ""In theory, nanopore sequencing allows you to sequence any length molecule of DNA. That's really quite different to how we have been sequencing DNA for many years now. The breakthrough in this paper is that we have been able to sequence a molecule of 2.3 million bases in length, which no one has ever been able to do before. ""Previously, the most common read length would be 150 bases [bases, or base-pairs, are the the four ""letters"" that make up the DNA sequence].  ""We were recently teaching people in Singapore how to use these sequencers at the same time as the grand prix. If the Singapore grand prix track is the same as 150 bases, then a 2.3 million base pair read is twice around the circumference of the earth"" he explained.   In November 2017, Dr Martin Smith from the Kinghorn Centre for Clinical Genomics in Australia announced that they had a read over a million bases. According to Dr Loose, the Ashes trophy was being packaged to make the journey to Australia, just as Nottingham produced a winning 1.2 million base pair read. That has now been surpassed again by the Beluga-sized 2.3 million base pair read.  These advances did not go down too well in Australia, with Dr Smith jokingly responding with ""Loose sucks"" image, using a mock-up of the nanopore software.  Dr Loose hopes that we will start to use these methods to look at things like cancer genomes, where the DNA gets rearranged. Chromosomes break and they fuse back incorrectly.  In an interview, Dr Smith told me that the first record-breaking baby ""whale"" of 473,000 bases was from a cancer cell line.  His team is studying these patient-derived cancer cells because their genomes are particularly disordered, much like a jigsaw puzzle that is missing pieces and has parts from another puzzle. In the future, the methods will also be used more routinely in the clinic, in disease outbreaks, and moving out of labs and into individuals' hands.  I also asked both scientists how long they thought the current record will stand and who will take the trophy next. Both agreed that the record might last for a year or so, but disagreed on who might win, whether the UK, Australia or a newcomer.  With a friendly look, Dr Smith told me: ""Matt should sleep with one eye open, because talking about this long read stuff has made me thirsty for a record again. Keep an eye out, we are going to get that Ashes cup again one day."" Dr Angus Davison is a geneticist at the University of Nottingham and has been a BSA media fellow at the BBC."
15,Australian awarded house in 'bizarre' 20-year squatting case - BBC News,http://www.bbc.com///news/world-australia-46039642,2018-10-31 19:11:09,Australia,http://www.bbc.com///news/world/australia,"Two decades ago, Australian property developer Bill Gertos found a house sitting empty in Sydney. So he changed the locks, repaired the property - and began leasing it to tenants. Now Mr Gertos has won a legal battle to be declared the official owner of the house - which is estimated to be worth A$1.6m (£0.9m; $1.1m). It followed a court battle with descendants of its previous owner. Mr Gertos was granted ownership under a law recognising squatters' rights. Squatting is when someone occupies an empty or abandoned property which they don't own or rent, and without the owner's permission. In New South Wales, squatters can be awarded ownership if they have occupied a property for more than 12 years. The court granted Mr Gertos those rights because he had repaired and maintained the property since 1998. Australian media outlets described the case as ""bizarre"" because the relevant law is typically used by those who move into a property themselves. Mr Gertos told the Supreme Court of New South Wales that he first became curious about the house, in the suburb of Ashbury, because it was in ""disrepair"".  He said he went to the property in late 1998 and determined that it was unoccupied and uninhabitable. ""I left the property and then decided to take possession of it myself,"" he said in a court affidavit. Mr Gertos spent nearly A$150,000 on repairs and renovations before installing tenants, the court heard. But the descendants of previous owner Henry Thompson Downie, who died in 1947, launched a legal challenge last year after Mr Gertos applied for ownership. Mr Downie's relatives testified that the family had vacated the house before World War Two due to an ant infestation, after which it was rented to a sole tenant. That tenant leased the home until her death in April 1998. The family argued that Mr Gertos had not acted in an ""open"" manner, meaning he should not be able to claim ownership through squatting laws. But Justice Rowan Darke disagreed, ruling: ""Mr Gertos succeeded in taking and maintaining physical custody of the land, to the exclusion of all others.""  Mr Downie's relatives intend to appeal the decision, the Australian Broadcasting Corporation reported."
16,Harry and Meghan: Duchess hugs 'Hannah from Instagram' - BBC News,http://www.bbc.com///news/uk-46044744,2018-10-31 22:42:48,UK,http://www.bbc.com///news/uk,"A woman who says the Duchess of Sussex supported her through her struggles with mental health by chatting to her on Instagram has said she was ""overwhelmed"" to meet the royal during her overseas tour. Hannah Sergel, from Christchurch, New Zealand, first spoke to Meghan on social media in 2016.  The pair met face to face in Auckland on Tuesday. After spotting Hannah in the crowds, Meghan rushed over to hug her. ""I was just so shocked,"" she told BBC News. ""I didn't expect her to recognise me and come over and give me a giant hug."" In pictures: Harry and Meghan's first tour She said the Duchess spotted her because she was holding a sign saying ""It's Hannah from Instagram"".  The 20-year-old waited for more than seven hours to meet Meghan on the royal couple's public walkabout at the Viaduct Harbour in Auckland.    She also gave Meghan a letter thanking her for her support, which the Duchess promised to read, Hannah added.  Hannah said she had been a fan of the actress since 2014 and Meghan helped her when she was struggling at university. ""She encouraged me to do what I love and be the best version of myself I can be,"" she said. ""I had to drop out of my course but she was still so sweet, encouraging me to keep going,"" she added.     The Duke and Duchess of Sussex visited New Zealand on the final leg of their 16-day tour. They have also been to Australia, Tonga and Fiji during their first overseas trip as a married couple. "
17,"Geoffrey Rush: Actress 'frightened' by alleged touching, court told - BBC News",http://www.bbc.com///news/world-australia-46026609,2018-10-30 18:37:04,Australia,http://www.bbc.com///news/world/australia,"An actress at the centre of a defamation case involving actor Geoffrey Rush says he ""deliberately"" touched her breast on stage, leaving her feeling ""frightened"". Eryn Jean Norvill told an Australian court that Mr Rush had also made groping gestures towards her during the production of King Lear in 2015. Mr Rush strongly denies the claims. He is suing a Sydney newspaper over stories published in 2017 which he says depicted him as a pervert. The Daily Telegraph's original report carried the headline ""King Leer"" and reported that Mr Rush, 67, had been the subject of a complaint about his behaviour during the Sydney Theatre Company production. On Tuesday Ms Norvill, who played Cordelia in the play, testified in Sydney's Federal Court as a witness for the newspaper's publisher, Nationwide News.  She accused the Oscar winner of inappropriately touching the side of her breast during a preview performance, in a scene in which he carried Cordelia's body. ""It couldn't have been an accident because it was slow and pressured,"" she told the court, adding that she had felt ""trapped"". Ms Norvill was not named in the newspaper's reports. Her testimony on Tuesday is the first time she has spoken publicly about the allegations. Speaking in court, the actress said that Mr Rush's behaviour during rehearsals had made her feel uncomfortable.  This included him allegedly making comments about her body, licking his lips, and telling her that she looked ""yummy"" and ""scrumptious"", Ms Norvill said. The actress testified that she had felt ""embarrassed"" and ""shamed"", and reluctant to speak out. ""I was at the bottom of the rung. He was at the top. His power was intimidating,"" she said. Mr Rush has vehemently rejected any allegations of inappropriate behaviour.  Last week, he told the court that he and Ms Norvill had enjoyed a ""very sparky, congenial rapport"". He had prepared for the scene in which he carried Ms Norvill across the stage by imagining his own daughter had died, the actor testified. Mr Rush is suing Nationwide News - owned by News Corp Australia - and journalist Jonathon Moran. He is seeking aggravated damages, arguing the articles significantly damaged his reputation. The publisher is standing by the stories. The trial is expected to run for another two weeks."
18,BBC - Culture - The 25 greatest foreign-language films,http://www.bbc.com/culture/gallery/20181026-the-25-greatest-foreign-language-films,,Culture,http://www.bbc.com/culture, 30 October 2018  International critics reveal why these non-English language films are classics of world cinema.  
