,title,url,created_time,tag_text,tag_url,article_text
21,BBC - Travel - Mexico’s bread baked for spirits,http://www.bbc.com/travel/story/20181030-mexicos-bread-baked-for-spirits,,Travel,http://www.bbc.com/travel,"David Roque Reyes Martínez has made pan de muerto (Day of the Dead bread) every year in his home in Oaxaca, Mexico, since he was 12 years old. Now 53, this tradition has marked his life each year in late October as Day of the Dead approaches. “It wouldn’t be Day of the Dead if there wasn’t bread,” Reyes said with a hearty laugh, followed by a more earnest expression as the idea settled in his mind.  You may also be interested in:• Kyrgyzstan’s bread that feeds the dead• Galicia’s mythic drink of blue fire• Why Romanians are obsessed with garlic Day of the Dead festivities begin on 31 October when families prepare for the return of spirits of deceased children on 1 November, known as Día de los Angelitos (Day of the Little Angels). The following day, 2 November is Día de los Muertos, Day of the Dead, when all other souls return. The nights of 31 October and 1 November, people visit cemeteries to decorate the graves of loved ones in preparation for the arrival of their spirits. Every year, beginning a few days before the celebrations, the Reyes household fills with the smell of cinnamon and anise, the aroma of the wood-burning oven, and, eventually, of freshly baked rolls, which he sells to neighbours who eagerly await it each year.  It wouldn’t be Day of the Dead if there wasn’t bread  Reyes likes to make the sweet bread at night. He enjoys the quiet time as he weighs the ingredients on his 50-year-old scales that were once used by his father, a panadero (baker) from whom Reyes first learnt to make bread. He thinks about his father as he bakes, he said, who died when Reyes was just 11 years old. The memories take not only the form of a painting of his father that will sit above an altar prepared in the last week of October, but also the form of the dough held in Reyes’ hands, which he kneads as his father taught him.  Working through the night is not without incidents, however, especially around this time of year, when it is believed by many that the dead travel back to the human world. “Do you remember the time when the bread suddenly fell off the edge here?” Reyes’ wife, María Antonia, asked her husband as she passed by the table where Reyes was preparing his ingredients, a table that was also used by his father. Reyes nodded and recounted that they were sure that it was his late father who pushed the bread onto the floor. “We said ‘stop that, old man’,” María Antonia told me with a laugh. This kind of casual conversation about death and spirits is not unusual in Mexico; and in my experience in Oaxaca, traditions around these topics are particularly strong. Every year, many families will build an altar in their home, topped with flowers, candles, water, bread and photos of their deceased loved ones. Each item has significance for guiding the dead back home: the flowers’ aroma leads spirits to the land of the living while the candles light the way. When they arrive, the bread eases their hunger and the water quenches their thirst. The favourite food and tipples of the deceased are also placed on the altar for them to enjoy upon their return.  The bread is also meant to be eaten by the living. Some families will eat the foodstuffs placed among the offerings after their ancestors have left the human world late on 2 November, but many, like Reyes, believe that the bread loses its flavour after the dead have enjoyed it. “It no longer tastes the same,” he said. “That’s where the mystical comes in. The essence [of the food] is taken away by the deceased.” Day of the Dead bread in its modern-day form cannot have been part of the pre-Hispanic traditions of honouring the dead, since many of the ingredients, most notably the wheat flour, were not found in Mexico until the arrival of the Spanish. In their book, Celebraciones Mexicanas: History, Traditions and Recipes, Andrea Lawson Gray and Adriana Almazan Lahl say that when the Spanish arrived on Mexican shores, the devout Catholics were horrified to find the practice of human sacrifice taking place. According to the book, one custom particularly disgusted the Spanish: a heart of a virgin was placed into a clay pot with amaranth before the ceremony leader took a bite of it in offering to the gods. In an attempt to eliminate this practice, the Spanish prepared a bread with a sticky, pink sugar topping – that represented blood – to be used in place of a real heart. Lawson Gray and Almazan Lahl describe how the Aztec’s “acceptance of this substitute marked the first time the Aztecs gave bread divine attributes, and the beginning of a slow transition to Catholicism.”  Now, across the country, there is a whole variety of different breads baked specifically for Day of the Dead. A fluffy, sugary white bread infused with orange essence and topped with extra dough shaped to represent bones, can be found in many areas of Mexico. In Oaxaca, however, the most common form of this bread – and the one Reyes makes – is pan de yema, a rich, sweet egg yolk-based bread. Pan de yema is sold throughout the year, but during Day of the Dead, a touch of anise and cinnamon is added for extra flavour and the bread is adorned with tiny decorative faces, or caritas. The idea in Oaxaca is that these caritas are the faces of the dead and the bread is their body. The faces are noticeably white-skinned, which Mexican food historian and chef Susana Trilling puts down to them being the representation of saints, adding another layer of syncretism. Day of the Dead, after all, overlaps with the Catholic All Saint’s Day, a link that’s clearly visible in areas like Puebla, about four hours north of Oaxaca, where some altars are adorned with white satin and Catholic iconography.  Back in Oaxaca, Reyes began to mix the ingredients on the table, getting into a rhythm generated by years of bread-making. He kneaded the bread with a punch, pull, slap, punch, pull, slap that was almost mechanical – a beat his family has heard for generations. “Because it is Day of the Dead, we have to kill the dough,” Reyes said with a chuckle and a glint in his eye as he continued to pound the mixture with an incredible strength. As we waited for the dough to proof, Reyes sat and told stories of Day of the Dead that had been told to him by his abuela, his grandmother, when he was young. One was a cautionary tale of a man who didn’t believe the dead returned to the human world. Despite his wife’s insistence, the man stubbornly refused to create an altar to his deceased parents, and instead left them two large biznaga cacti; since they weren’t really coming back, he argued that it didn’t matter what he left in offering.  The deceased don’t die as long as they remain in someone’s memory  Later that night the man was on a hilltop above the town and saw a trail of people walking together. He got closer and saw they were carrying flowers, mole and bread. Suddenly he saw his deceased mother and father struggling to carry the prickly cacti back to the afterlife. The man was distraught and ran back home to plead forgiveness, and every year after, he created a huge altar for his deceased loved ones. “Have you seen Coco?” Reyes suddenly asked as he came to the end of his story, referring to the Disney-Pixar film that came out last year. I smiled and said I had. “It is not far from the truth,” he said, talking about the message of the film. “The deceased don’t die as long as they remain in someone’s memory.”  Once the raw dough was shaped into perfectly round balls, Reyes arranged them on parchment paper in preparation for baking in his homemade wood-fired oven. The mounds varied in size, from tiny bite-size rolls to larger half-kilo rounds. “The smallest breads are for the angelitos,” Trilling explained when I asked about the different-sized loaves a few days later. As Reyes placed the rolls into the oven and closed the door, he chuckled and exclaimed, “Now we have buried the dead.”  The best thing I inherited was this knowledge  The smell of baking bread filled the air and made our mouths water. The perfectly baked caramel-brown loaves were pulled from the oven just as María Antonia finished preparing steaming Oaxacan hot chocolate. We ripped off pieces of bread and dipped them into our mugs to soak up the liquid; the cinnamon- and anise-infused, sweet rolls combined with the rich chocolate was simply delicious. “The best thing I inherited was this knowledge,” said Reyes as he popped a slice of bread into his mouth. Join more than three million BBC Travel fans by liking us on Facebook, or follow us on Twitter and Instagram. If you liked this story, sign up for the weekly bbc.com features newsletter called ""If You Only Read 6 Things This Week"". A handpicked selection of stories from BBC Future, Earth, Culture, Capital and Travel, delivered to your inbox every Friday.  "
22,BBC - Culture - The luxurious Modernist homes of Hollywood legends,http://www.bbc.com/culture/story/20181024-the-luxurious-modernist-homes-of-hollywood-legends,,Designed,http://www.bbc.com/culture/designed,"For the stars of Hollywood’s golden age, the curation of a glamorous off-screen image was as carefully controlled as the lighting on a Tinseltown studio set. Maintaining an aura of perfection was critical to an actor’s livelihood and – by extension – their home spoke volumes about what set them apart from the average cinemagoer. A new book, Hollywood Modern: Houses of the Stars by Alan Hess and Michael Stern, offers a glimpse into this glamorous lifestyle. Photos show the inspiring futuristic architecture of southern California – from the minimal to the opulent – designed to set the standard for ideal living for celebrities by some of the era’s most innovative architects.                "
23,Access Denied,https://www.bbcearth.com/blog/?article=tracking-endangered-turtles-from-space,,Earth,https://www.bbcearth.com/, Reference #18.7ff46668.1541030751.3e176a3 
24,Royole's bendy-screen FlexPai phone unveiled in China - BBC News,https://www.bbc.com/news/technology-46048601,2018-11-01 05:50:23,Technology,http://www.bbc.com///news/technology,"A little-known California-based company has laid claim to creating the ""world's first foldable phone"". Royole Corporation - a specialist in manufacturing flexible displays - unveiled the FlexPai handset at an event in Beijing. When opened, the device presents a single display measuring 7.8in (19.8cm) - bigger than many tablets.  But when folded up, it presents three separate smaller screens - on the front, rear and spine of the device. The six-year-old company said it would hold three ""flash sales"" to consumers in China on 1 November to offer the first product run.   The phones will be priced between 8,999 and 12,999 yuan ($1,290 to $1,863; £1,011 to £1,460) depending on the memory and storage specifications selected. In addition, Royole said it would also offer a slightly different version of the devices to developers across the world the same day. It intends to start deliveries in ""late December"". The launch has caught many industry watchers by surprise.  It was widely believed Samsung or Huawei would be the first to sell such a device to the public. Samsung was expected to preview its efforts at an event in San Francisco on 7 November, but is not understood to be ready to put a product on sale.  Venturebeat reporter Evan Blass has also claimed LG intends to unveil a foldable phone of its own at the CES trade show in January. Videos posted to social media of the FlexPai in action, however, indicate the version of Android they run still needs some work. In particular, the display is shown to flick between different orientations after being switched from one mode to another before settling.  Purchasers will also need to be mindful that the device weighs 320g - more than 50% more than the iPhone XS Max or Galaxy Note 9. However, Royole says the FlexPai has been tested to withstand more than 200,000 open-and-shut movements, meaning it should offer many years of use before the action damages the picture. One expert said the smartphone was unlikely to become a bestseller but was impressive nonetheless. ""Royole gets the bragging rights to being first, and it's quite astonishing that someone you've never heard of is doing this,"" said Carolina Milanesi, from the Creative Strategies consultancy. ""What's great is that it's putting this into the hands of developers, who will be able to start the legwork that will result in apps for flexible devices that will eventually be sold by Samsung and whoever else. ""You need developers to think through how they can best take advantage of screens that double in size."" She added that Royole might ultimately become an acquisition target for one of the mainstream consumer electronics brands.  Another company-watcher added that he doubted the FlexPai would ever be produced in large numbers. ""Royole has carried out several publicity stunts over the years to showcase its flexible OLED [organic light-emitting diode] displays,"" said Dr Guillaume Chansin from Irimitech Consulting. ""The FlexPai is probably another stunt. ""Royole is building its first OLED factory and it is now trying to compete directly with other display manufacturers such as Samsung and LG."""
25,Do schools help or hinder social mobility? - BBC News,https://www.bbc.com/news/business-46013665,2018-10-31 11:20:50,Business,http://www.bbc.com///news/business,"Do schools help social mobility and fairness? Or do they give even more advantages to the better-off? Even if they can't make up for all inequalities, at least we might expect them to make the playing field more level. But a major international study on social mobility from the OECD economics think tank shows a more sobering picture. Each year that a child spends in education, the gap between rich and poor grows wider. On average, across more than 60 countries, that difference between the richest and poorest is the equivalent to three years of schooling by the age of 15. Only about one in 10 children from poor backgrounds will achieve the same results at those from wealthy backgrounds. The study tracked test results taken by 10-year-olds in 1995, 15-year-olds in 2000 and then a decade later for young adults in their mid-20s. At each point the social divide, with few exceptions, tended to widen.  It's not that difficult to see how this happens.  The children of more prosperous families are travelling in an educational fast lane, with more support from home, a higher chance of getting into a good school and university, and benefiting from the interventions of better-educated parents. The accumulation of advantages will amplify differences. According to the study, on average by the age of 15 about 13% of the variation in students' performance will be determined by their social background. This varies between countries. In the UK, it's below average at 11%, with Norway and Estonia lower at 8%. In France it's 20% and in Germany and Switzerland it's 16%. But it's not all pessimism. The OECD's head of education Andreas Schleicher, argues there is also plenty of evidence to say that ""poverty need not be destiny"". There are school systems where many more disadvantaged children do well.  In countries such as Singapore, Japan and Finland, the test results of the poorest 20% are higher than the richest 20% in the Slovak Republic, Uruguay, Brazil and Bulgaria. The UK does quite well on this measure, with the median point for UK students being above the wealthiest 20% in Italy and not far behind those similarly advantaged students in Spain. ""It shows that students from very similar backgrounds can have very different outcomes,"" says Mr Schleicher. He says it's a cause for optimism that some countries have made sure that ""excellent teaching"" is available for rich and poor pupils. The study also found other factors associated with disadvantaged pupils defying the odds, including in Vietnam and China. One pattern that emerged strongly was the importance of the social profile of the school they attended. In many countries, disadvantaged students tend to be clustered together in schools with other similarly disadvantaged students. If this can be prevented, the study shows that disadvantaged students taught in schools with a wealthier intake tend to have much higher results. But the research also shows how easily inequality can be absorbed into education systems. ""A rising tide doesn't automatically lift all boats,"" says Mr Schleicher. Numbers going into university have increased - but that doesn't necessarily make it a fairer system.  In Singapore, many going to university will be the first in their families to get a degree. It's an example of social mobility and widening doors. But in Italy, wealthier families have been much more likely to benefit from extra university places, widening the education gap. In terms of ""equity"", Italy has been going backwards, says Mr Schleicher. There are also generational divides. In the US, looking at people between 26 and 65, the older age groups are much more likely than the younger ones to have advanced further in education than their parents. You can see educational mobility withering through the more recent decades. The big picture is the struggle to kick-start social mobility in Western democracies. A report earlier this year from the OECD showed that in the UK, social mobility was so frozen that it would take five generations for poorer families to reach the average income.  ""Meritocracy is the big promise of our democracies, and social mobility is the truth test for meritocracy,"" says Mr Schleicher. ""So, yes, I think we need to worry if social mobility is limited or slowing down."" He says the slowdown is not simply a case of there being many more people with higher qualifications competing with each other, because the demand for graduates and skilled workers has increased at least as rapidly. Instead he warns of a system in which social division becomes embedded. ""Lower social mobility and higher income inequality tend to go together,"" he says.  As the wealthiest families accelerate even further ahead, it's likely to even further narrow the chances for ""talented yet underprivileged individuals"" who are being left behind. ""It's a worry, because it shows our education systems have not been able to moderate social inequality. Instead social inequality has grown,"" says Mr Schleicher. More from Global education The editor of Global education is sean.coughlan@bbc.co.uk"
