,title,url,created_time,tag_text,tag_url,article_text
0,Khashoggi murder: Turkey gives official details of Saudi writer's death - BBC News,http://www.bbc.com///news/world-europe-46049204,2018-11-01 09:45:52,Europe,http://www.bbc.com///news/world/europe,"Turkey has given its first official statement on how it believes Saudi writer Jamal Khashoggi was killed, saying he was immediately strangled. The statement follows weeks of media reports about the murder at the Saudi consulate in Istanbul on 2 October. Turkey has yet to provide evidence.  Chief prosecutor Irfan Fidan said meetings with his Saudi counterpart this week led to ""no concrete results"".  Saudi Arabia has not commented on the meetings. The Turkish statement said: ""In accordance with plans made in advance, the victim, Jamal Khashoggi, was choked to death immediately after entering the Consulate General of Saudi Arabia."" His body was then dismembered and destroyed ""again, in line with advance plans"", it added.  Khashoggi, a Saudi national working for the US press, was a well-known critic of his home country's rulers. His body has not been found, but Turkey, the US and Saudi Arabia have all agreed that he was killed at the consulate.   There is still no consensus on how he died.  Turkey said it had put three main questions to the Saudis during the prosecutor's visit: An unnamed Saudi official previously told Reuters news agency that Khashoggi's body had been rolled in a rug and given to a ""local co-operator"", who disposed of it.  On Wednesday, the delegation responded the questions in writing, according to Turkey.  Saudi Arabia said the answers could only come from a joint investigation. It also noted that it had never given an official statement on the existence of a ""co-operator"". Turkey has steered away from publicly blaming Saudi Arabia for the killing. However, a senior spokesperson from the ruling AK Party said on Wednesday that it could not have been carried out without orders from someone in a senior position. Saudi Arabia denies its royal family was involved.  Turkish President Recep Tayyip Erdogan spoke to Saudi King Salman last week, and the two agreed to continue co-operating in the investigation. Unnamed Turkish officials have previously told media outlets that they had audio and visual evidence to prove their accounts of the writer's death, but nothing has been released.  Turkish media have published details on how sources say Khashoggi was killed, including allegations he was tortured.   His Turkish fiancée, Hatice Cengiz, gave a tearful interview to local television last week, saying she would never have let her partner enter the consulate if she had thought that the ""Saudi Arabia authorities would hatch a plot"" to kill him. He had entered the consulate to sort out documents for their marriage.  Attorney General Sheikh Saud al-Mojeb met Mr Fidan twice, visited the consulate and spoke with Turkey's intelligence agency during his visit to Istanbul this week. He flew back to Saudi Arabia on Wednesday without making an official statement.  Saudi Arabia has changed its account of what happened to Khashoggi.  When he first disappeared, it said Khashoggi had walked out of the building alive. It later admitted he had been murdered, saying the killing was premeditated and a result of a ""rogue operation"". Saudi Arabia has subsequently said that Khashoggi was murdered, and that it is ""determined to find out all the facts"". It has arrested 18 suspects, who, it says, will be prosecuted in Saudi Arabia. Turkey wants the suspects to be extradited. Saudi Arabia has faced backlash over the death, including from its allies, who have called for answers.   President Donald Trump has said he is ""not satisfied"" with the Saudi account. However, he also said he was unwilling to sacrifice lucrative arms deals with the country.  Meanwhile, US activists have launched a petition, calling for a section of road near the Saudi embassy in Washington to be renamed Jamal Khashoggi Way. On Wednesday, France's foreign minister Jean-Yves Le Drian said Khashoggi's death was a ""crime"" and ""odious"".  He said France was not ""dependent on our economic relations with Saudi Arabia"" and the country would impose sanctions, but no details were given.  UK Foreign Secretary Jeremy Hunt also said it was an appalling act, adding that it had ""possibly"" given the US and the UK a chance to put new pressure on Saudi Arabia over other issues.  Earlier in the day, the US called for a swift cessation of hostilities in Yemen, where a Saud-led coalition has been fighting local Houthi rebels. "
1,Mystery surrounds deaths of Saudi sisters found in New York - BBC News,https://www.bbc.com/news/world-us-canada-46039480,2018-11-01 05:54:22,World,http://www.bbc.com///news/world/us_and_canada,"Police in New York are investigating the deaths of two sisters from Saudi Arabia who were found duct-taped together in the Hudson River last week. Tala Farea, 16, and Rotana Farea, 22, were discovered facing each other and fully clothed without any obvious signs of trauma, police say. Investigators say it is too early to determine if any crime occurred or if their deaths were caused by suicide. The girls had recently applied for US asylum, police said. The Farea sisters moved from Saudi Arabia to Fairfax, Virginia, in 2015 with their mother, and had a history of running away from home, according to US officials. But investigators say it remains a ""puzzle"" as to how they came to be found dead on a riverbank more than 250 miles (400km) from their family's home. The Saudi Consulate General said in a statement that embassy officials had contacted their family, and added that the sisters were students ""accompanying their brother in Washington"". The Associated Press, citing New York police, said that the day before their bodies were discovered, their mother received a call from an official at the Saudi embassy ordering the family to leave because the girls had applied for political asylum. The girls were discovered in Riverside Park last Wednesday wearing black leggings and black jackets and with duct-tape around their waists and ankles.  Police had originally theorised that the girls may have jumped from the George Washington Bridge, but ruled that out after finding a lack of obvious injuries which they would have sustained in the fall. After releasing sketch drawings of the sisters, police were able to identify them on Friday, and are now seeking the public's help in learning more about their lives in the New York metro area in the past two months. At a press conference on Wednesday, the city's chief of detectives said there are some ""gaps"" in the sisters' history, which investigators are trying to resolve.  ""I'm confident that when the complete investigation is done we'll have a good idea of what exactly transpired,"" said Detective Dermot Shea."
2,BBC - Travel - The island that never stops apologising,http://www.bbc.com/travel/story/20181031-the-island-that-never-stops-apologising,,Travel,http://www.bbc.com/travel,"Yun-Tzai Lee and Joanne Chen are one of those sickening couples that finish each other’s sentences, lace their fingers together and just won’t stop oozing adorable. But the three little words ‘I love you’ don’t come as easily to Lee as they do to his fiancée Chen. His face turns beetroot-red at the thought of uttering the phase, and causes him to feel ‘buhaoyisi’ (pronounced ‘boo-how-eee-suh’) – one of the many ways to feel mortified or to be sorry in Taiwan.   “Most people here will feel this way,” Lee said. Welcome to the linguistic minefield of apologising in Taiwan, where simply saying ‘buhaoyisi’ can open a Pandora’s Box of profuse politeness. The word is made up of four characters that literally translate to ‘bad meaning’ or ‘bad feeling’, and serves as a tidy catch-all that can be deployed in all kinds of situations, from meekly catching a waiter’s attention to expressing a guilt-ridden apology to your boss to the paralysing feeling that washes over you as you struggle to confess your love.  You may also be interested in:• The complex art of apology in Japan• Where being nice is the law• The country that loves to give Buhaoyisi is forever on the lips of Taiwanese, according to Prof Chia-ju Chang, Chinese professor at Brooklyn College City University of New York. “We use it all the time as Taiwan is a verbally polite culture. So, we use it when we interrupt people or asking of a favour. We can even use it to start a conversation.” Buhaoyisi is often spoken so fast that it comes out as a slurry of consonants that sounds like gibberish to the unsuspecting ear. And unlike ‘Entschuldigung’ in German or ‘excuse me’ in English, translating ‘buhaoyisi’ is no simple task, says Ouyu Yang, a teacher at National Taiwan University’s Chinese Language Division. The Western notion of ‘sorry’ is far too limited to express all the social graces and good form that weigh down on this loaded expression; buhaoyisi can also be a feeling, a sensation, a code of conduct and a whole system of thought that permeates Taiwanese culture.  The Western notion of ‘sorry’ is far too limited to express all the social graces and good form that weigh down on this loaded expression  Ride the subway in Taipei and you’ll hear a cacophonous chorus of ‘buhaoyisi’ as passengers gingerly nudge past others in humble deference. Enter a classroom, and you’ll see students start and end each question with ‘buhaoyisi’, dripping with a sense of indebtedness and gratefulness even as the discussion continues. Open an email, and the first line will usually be ‘Buhaoyisi’ – implying ‘sorry to slightly bother you’ – even for the smallest of favours. And if a dear cousin gives you a gift, the correct response isn’t ‘thank you’, but rather, ‘buhaoyisi’ for the inconvenience I’ve caused you. For the uninitiated outsider, Taiwan may seem like the world’s most apologetic country, a nation obsessed with saying sorry – but in fact, the culture of buhaoyisi reveals a lot about the islands’ hidden layers of modesty and shyness.  Decades of Japanese colonisation, as well as moral teachings of Confucianism, have played a huge hand in shaping Taiwan’s extreme apology culture to what you see and hear today, according to Khin-huann Li, sociolinguistics professor emeritus at National Taiwan Normal University. Although the phrase’s exact origins are unknown, Li and other linguists theorise that it is largely a product of the millennia-old Confucian notion of harmony, which centres on maintaining interpersonal relationships rather than individual ones. Preserving social cohesion at all costs is still the bedrock of Taiwan’s social morality; placing the larger clan, the society, before yourself, the individual, is key. In addition, part of Taiwan's buhaoyisi culture is heavily influenced from Japan’s sumimasen apology culture, with the two sharing a deep history.  Overall, as a habit, saying buhaoyisi often helps confrontations from escalating further, Li said. “Traditional Taiwanese culture is like that – more delicate and thinking of other people, trying to keep polite relationships with others,” he explained.  On the one hand, the expression carries an air of submissiveness and hyper decorum, but on the other hand, it also demonstrates the unparalleled politeness of Taiwan. That's why, for the traveller, saying sorry in Chinese can easily turn into a linguistic minefield. When in doubt, Li says, err on the safe side and just say buhaoyisi; chances are they’ll say buhaoyisi back to you. It’s the unspoken rule on the islands of Taiwan. Li also suggests that this culture of buhaoyisi is unique to Taiwan, as opposed to the rest of the Chinese-speaking world; while you'll hear buhaoysi many times over throughout the streets of Taiwan, you are less likely to hear buhaoyisi being used in this way in China or Malaysia, which place less emphasis on such polite-isms.  When in doubt, err on the safe side and just say buhaoyisi  According to InterNations’ Expat Insider Index, Taiwan is consistently ranked as one of the world’s friendliest countries. Around 90% of expats in Taiwan gave residents high marks for hospitality, compared to a combined average of 65% in the rest of the surveyed countries. Nowadays, more than one-third of expats are considering staying on the tiny Pacific island forever, according to the survey of 12,500-plus respondents around the world. The secret to attracting people to the lush, tropical islands of Taiwan is really no secret at all – just be, well, nice. However, according to 25-year-old pharmacist Jieru You, who lives in the port city of Kaohsiung, this nice, little narrative that Taiwan is leading the world in friendliness may be a false one, or at least not the full picture. Having to make yourself smaller and apologise constantly for small inconveniences, and sometimes even your mere presence, can ultimately do more harm than help. And ironically, asking permission to do, to speak, to come and to go all the time can be unnecessarily inconveniencing yourself more than anyone else. “When making a request to someone else, Taiwanese people will often use buhaoyisi as a lead-in to express their desire to ask for help from a place of humble submission,” You said. As a matter of fact, he was already feeling a bit ‘buhaoyisi’ – embarrassed to be interviewed at all – before diving into his thoughts.  The concept of ‘saving face’ is a big deal in Taiwan. Imagine a chessboard of social exchanges, in which everyone else’s moves affects your next one. Face, in this case, is the social currency that allows you to make friends and foster professional connections that can lead you to your next big job, an investment in your company or even a warm introduction to your future wife. Without ‘face’, people are less likely to trust you or help you get ahead in life. The end game is to protect yourself, your self-image and your dignity and curry favour with others by reciprocating their acts of kindness. That’s why Taiwan is confrontation-averse; it’s a country constantly striving to avoid conflicts and preserve harmony at all costs. But what happens when fiercely following that moral compass goes awry? You just might get something akin to Taiwan’s conundrum of over-apologising.  The end game is to protect yourself, your self-image and your dignity  On the flipside, people with ‘thin face’, meaning a lack or loss of your social reputation and status, try not to trouble others for fear of inconveniencing them, and they certainly don't like to lose face in public, adds Yang. So instead of standing up, everyone sits down and stays there while little gets done. Yang feels like she’s drowning in a pool of too many perfunctory apologies, in which saying buhaoyisi is more of a habit than a word with deeper meaning. The result is half-hearted, stripped of any sincere apology or regret. Not to mention, thanks to the island’s growing global isolation and economic malaise, Taiwanese are suffering from the poetically named syndrome of guidao, or ‘ghost island’.  On the world stage, Taiwan’s identity is often misunderstood, says Wenhui Chen, informatics professor at Ming Chuan University, who studies the ghost-island phenomenon. He says that the island is often viewed as a pawn between China and the US, floating along without many of the diplomatic trappings of an officially recognised country. Chen predicts Taiwan’s apologetic, kow-towing culture may not prove so fruitful in the end, and could even lead to the society’s own undoing. Of course, not everyone bears such a doom-and-gloom forecast for Taiwan. Li, for his part, sees the island’s deep buhaoyisi culture as integral to keeping the peace – and if the culture of buhaoyisi disappears, then so will centuries of timeworn tradition. “If the society keeps these concepts and expresses these words daily, then the society could be more polite, more moral and more conservative,” Li said. “If not, the society becomes impolite, immoral and too aggressive. Taiwan’s culture [must] be kept in a good shape in terms of morality and harmony.” He then ended with the obligatory ‘buhaoyisi’. Why We Are What We Are is a BBC Travel series examining the characteristics of a country and investigating whether they are true. Join more than three million BBC Travel fans by liking us on Facebook, or follow us on Twitter and Instagram. If you liked this story, sign up for the weekly bbc.com features newsletter called ""If You Only Read 6 Things This Week"". A handpicked selection of stories from BBC Future, Earth, Culture, Capital and Travel, delivered to your inbox every Friday. "
3,French Ain babies: Missing limb births prompt national inquiry - BBC News,https://www.bbc.com/news/world-europe-46043564,2018-11-01 04:30:55,Europe,http://www.bbc.com///news/world/europe,"France has launched a national investigation into the number of babies being born with missing arms or hands - weeks after an initial inquiry closed. The first investigation began after it emerged more than a dozen children had been born with the condition in clusters in three French regions. It ended after health authorities failed to identify a common cause. But now another 11 cases have emerged in the eastern region of Ain, prompting officials to open a fresh inquiry. The condition is a type of agenesis, where the upper limbs of a foetus fail to form correctly during pregnancy.  It includes entire missing upper limbs, missing forearms and hands, or fingers - but not unrelated medical conditions, such as missing thumbs. The cases are clustered in the rural Ain area not far from the Swiss border, as well as in Brittany and Loire-Atlantique, two neighbouring regions on the north-west coast. Health Minister Agnès Buzyn had already pledged a further investigation in the wake of the initial report's lack of explanations, amid continued public concern and widespread media coverage. Speaking on French television on Wednesday morning, she said the first results from the national inquiry would be published in January, with more to follow by summer. ""I think all of France wants to know,"" said Ms Buzyn. ""We don't want to rule anything out. Perhaps it's do with the environment, or something they ate, or something they drank. Perhaps it's what they breathed - right now I just don't know."" All the cases reported in Ain involve people within a 17km (11 miles) radius of the village of Druillat, leading to speculation about the possible influence of pesticides - which has yet to be proven.  The stories of some affected children were widely covered in the French media in the wake of the first report. Ryan, now aged eight, is one of the children from the Ain region who is missing a hand. His parents told French news channel Franceinfo that there had been no hint of a problem on ultrasound scans. Instead they found out when he was born, and doctors were unable to tell them why.   Another affected mother, from Brittany, said she was quizzed by doctors after the birth of her son Leo with a malformed forearm.  They wanted to know about eating habits or any pharmaceuticals of drug use - but again, could not find a cause. Chair of the scientific committee in Ain's regional health centre, geneticist Dr Elizabeth Gnansia, said the number of concentrated cases of a rare condition was significant. ""Let's imagine they are born between 2009 and 2014, which is five years, can you imagine that in a small rural school seven infants are in the same school with a type of amputation of forearm?"" she said. ""We don't need statistics for that. It's highly significant. It's 50 times what you expect."" The regional register for birth defects, Remera, had raised concerns about a possible surge in cases in Ain in July, following reports from local doctors. It discovered seven cases clustered close together around Druillat over six years. But an initial report from Public Health France in October concluded that those cases, between 2009 and 2014, were not significantly higher than the national average.  However, it now says that the 11 new cases it uncovered were all from Ain, covering 15 years since 2000.  Three other cases in Loire-Atlantique and four in Brittany were also looked at. In those cases, the health body acknowledged that the numbers were higher than average - but again, no common cause was found. Officials concluded that in all three regions, further investigations were not possible without a hypothesis to pursue.  The report also said that monitoring of birth defects was only carried out by a handful of registers, covering just 19% of births in France. That has prompted some fears that the number of cases may be under-reported. On Tuesday, Public Health France announced that the new cases had  been uncovered by a further analysis of hospital databases. It warned that a comprehensive survey several years after the birth of affected children would be ""complex"". The case has drawn parallels with the Thalidomide scandal, involving a drug often taken by pregnant women to alleviate morning sickness. The link between Thalidomide and limb malformation during pregnancy was only uncovered after years of the drug's use. However, no such link between a chemical or pharmaceutical cause has been drawn in France."
