,title,url,created_time,tag_text,tag_url,article_text
27,Spinal implant helps paralysed patients walk again - BBC News,http://www.bbc.com///news/health-46050054,,Health,http://www.bbc.com///news/health,
29,Global hunger for soybeans 'destroying Brazil's Cerrado savanna' - BBC News,http://www.bbc.com///news/world-latin-america-46022184,,Latin America & Caribbean,http://www.bbc.com///news/world/latin_america,
30,US mail bombs: Who is George Soros? - BBC News,http://www.bbc.com///news/uk-44392441,,World,http://www.bbc.com///news/world,
31,What America's 'Blexit' gets wrong about history - BBC News,http://www.bbc.com///news/world-us-canada-46051886,,US & Canada,http://www.bbc.com///news/world/us_and_canada,
32,Pittsburgh shooting: Trump visits amid protests - BBC News,http://www.bbc.com///news/world-us-canada-46039389,,US & Canada,http://www.bbc.com///news/world/us_and_canada,
33,Boris Johnson struggles in interview - BBC News,http://www.bbc.com///news/uk-40358825,,UK,http://www.bbc.com///news/uk,
34,North America prepares for August solar eclipse - BBC News,http://www.bbc.com///news/world-us-canada-40362067,,US & Canada,http://www.bbc.com///news/world/us_and_canada,
35,Koalas 'facing extinction' in some Australian states - BBC News,http://www.bbc.com///news/world-australia-40365981,,Australia,http://www.bbc.com///news/world/australia,
36,Video 'shows destruction of Mosul's Great Mosque of al-Nuri' - BBC News,http://www.bbc.com///news/world-middle-east-40366136,,Middle East,http://www.bbc.com///news/world/middle_east,
37,'Devil wheel' rider: It makes me happy - BBC News,http://www.bbc.com///news/world-asia-40360168,,Asia,http://www.bbc.com///news/world/asia,
38,Barcelona port: Fire as ferry crashes into crane - BBC News,http://www.bbc.com///news/world-europe-46049744,,Europe,http://www.bbc.com///news/world/europe,
39,Jamal Khashoggi's impact on the war in Yemen - BBC News,http://www.bbc.com///news/world-middle-east-46051206,,Middle East,http://www.bbc.com///news/world/middle_east,
40,What do American voters care about? - BBC News,http://www.bbc.com///news/world-us-canada-45997010,,US & Canada,http://www.bbc.com///news/world/us_and_canada,
41,One-minute World News - BBC News,http://www.bbc.com///news/10462520,,Video,http://www.bbc.com///news/video_and_audio,
42,Viola Davis explains why there's a long way to go to eliminate racism - BBC News,http://www.bbc.com///news/entertainment-arts-46023026,,Entertainment & Arts,http://www.bbc.com///news/entertainment_and_arts,
43,Kanye West announces he's distancing himself from politics - BBC News,http://www.bbc.com///news/newsbeat-46041577,2018-10-31 18:48:26,Newsbeat,http://www.bbc.com///news/newsbeat,"Kanye West says he's ""distancing"" himself from politics. On Twitter the rapper claims he's being ""used to spread messages I don't believe in."" He has been a vocal supporter of President Trump but this decision appears to centre around a campaign he was linked to known as Blexit. Run by Conservative commentator Candace Owens it encourages black Americans to quit the Democratic party. She claimed the musician had designed clothing for the campaign, something which the rapper has now denied.    The rapper tweeted: ""My eyes are now wide open. I am distancing myself from politics and completely focusing on being creative.""  It seems Kanye West intends to step away from politics altogether now.   Writing to his 28.7 million followers the musician said: ""I support creating jobs and opportunities for people who need them the most. ""I support prison reform, I support common-sense gun laws that will make our world safer.  ""I support those who risk their lives to serve and protect us and I support holding people who misuse their power accountable.""  It's not the first time, the rapper, who wants to be referred to as Ye, has had to clear up his political beliefs. Earlier this year he came under fire for for saying that the 13th amendment of the US Constitution, which brought an end to slavery, should be abolished - a statement that he later clarified. Apparently he meant to write ""amend"". And his performance on the American comedy show Saturday Night Live a few weeks ago sparked outrage and amusement in equal measure. The 41-year-old, who is married to Kim Kardashian, wore a hat with Donald Trump's slogan ""Make America Great Again"" and apparently gave an unscripted, off-air rant in support of the president.  Excerpts filmed by the audience and shared on social media show the rapper discussing his support for President Trump, his pledge to run for president in 2020 and the need for a ""dialogue not a diatribe"". ""So many times I talk to a white person and [they] say, 'How could you like Trump, he's racist?'"" he said.  ""Well, if I was concerned about racism I would've moved out of America a long time ago.""  Kanye West has been very upfront about his support for President Trump. The pair have met several times discussing issues including employment and criminal justice reform. However stars including Snoop Dogg, T.I. and John Legend have criticised Kanye West for meeting the US leader.   Kanye West ended this latest series of messages saying: ""I believe in love and compassion for people seeking asylum and parents who are fighting to protect their children from violence and war."" ""I would like to thank my family, loved ones, and community for supporting my ACTUAL beliefs and my vision for a better world."" Follow Newsbeat on Instagram, Facebook and Twitter. Listen to Newsbeat live at 12:45 and 17:45 every weekday on BBC Radio 1 and 1Xtra - if you miss us you can listen back here."
44,Fake Cambridge Analytica ad hits Facebook - BBC News,http://www.bbc.com///news/technology-46043578,2018-10-31 23:20:26,Technology,http://www.bbc.com///news/technology,"A fake advert purporting to have been paid for by scandal-hit Cambridge Analytica has been posted to Facebook. The ad, now removed but still visible in Facebook's new ad transparency portal, uses the logo of EU referendum campaign group BeLeave, which, in July, was found to have broken electoral law.  It calls for a new immigration policy, saying: ""Our current system is broken."" News site Business Insider confirmed to the BBC that it made the ad for a story on Facebook's advertising tools. Cambridge Analytica closed down operations in May. ""This ad was not created by Cambridge Analytica,"" a Facebook spokesman said. ""It is fake, violates our policies and has been taken down.  ""We believe people on Facebook should know who is behind the political ads they're seeing, which is why we are creating the Ads Library so that you can see who is accountable for any political ad.  ""We have tools for anyone to report suspicious activity such as this."" Jim Edwards, editor-in-chief of Business Insider UK said, ""We hope our story will push Facebook into making its advertising system more secure and less open to abuse."" The ad was spotted by Guardian and Observer journalist Carole Cadwalladr. ""It just highlights how completely useless Facebook's new transparency rules are,"" she told the BBC. ""I can't think how they ever thought they were going to work - anybody can write anything in that box."" From 16 October, Facebook's new rules for political ads in the UK came into effect. The social network had claimed that creators of such ads would have to prove their identity and location. However, the resilience of Facebook's system has been called into question. News site Vice was able to post ads purporting to be paid for by every sitting US senator, a total of 100 individuals. ""Receiving approval to run an ad 'paid for' by a senator typically just took a few minutes,"" said Vice journalist William Turton. The fake ad comes as the UK and Canadian parliaments join forces to demand that Facebook chief executive Mark Zuckerberg respond to MP's questions over the Cambridge Analytica scandal. A hearing will be held by the UK House of Commons digital, culture, media and sport committee on 27 November. In a joint letter, the organisers appealed to Mr Zuckerberg to make an appearance. ""We would have thought that this responsibility is something that you would want to take up,"" wrote chair of the House of Commons committee Damian Collins and Bob Zimmer, chair of the Canadian standing committee on access to information, privacy and ethics."
45,Parkinson's disease 'may' start in gut - BBC News,http://www.bbc.com///news/health-46050744,2018-11-01 05:09:05,Health,http://www.bbc.com///news/health,"The brain disease Parkinson's may actually start in the depths of the digestive system, US scientists say. In their study, people whose appendix had been removed were less likely to develop the neurodegenerative disease. And the appendix, long thought of as pointless in the human body, contained the substance that kills brain cells.  Parkinson's UK said the findings were the most compelling evidence yet that the disease's origins lie outside the brain. In Parkinson's, toxic proteins build up in the brain to kill nerves, particularly those linked with movement.  It might feel counter-intuitive, but there is now growing evidence that the gut is involved.  Researchers at the Van Andel Research Institute, in Michigan, looked at data on 1.7 million people over half a century.  The study, published in Science Translational Medicine, showed the risk of Parkinson's was 20% lower in the people who had had their appendix removed.  The appendix is a little sac at the opening of the large intestine and is probably the best known vestigial (without a use) organ in the human body.  And analysing the content of people's appendixes showed they contained the same toxic protein - called alpha synuclein - that is found in the brains of Parkinson's patients.  The appendix is clearly not the whole of the story (otherwise removing it would prevent all cases). But the researchers argue the guts are a breeding ground for the protein, which then travels up the vagus nerve and into the brain.  One of the researchers, Dr Viviane Labrie, said people should not rush to have their appendix removed. She said: ""We're not advocating appendectomy as a form of protecting against Parkinson's disease.  ""It would be much more wise to control or dampen excessive formation of alpha synuclein to tune down the overabundance or potentially to prevent its escape."" The idea that the gut is involved in Parkinson's is rapidly gaining attention.  Patients often report digestive disorders, cutting the vagus nerve is linked to a lower level of Parkinson's and animal studies have suggested bacteria that live in the gut are key.  Claire Bale, from Parkinson's UK, said: ""This research is really important because it gives us some of the most compelling evidence yet that Parkinson's may begin outside the brain, which is a revolutionary new idea that is emerging in the scientific world.  ""Understanding where and how Parkinson's begins will be absolutely crucial to developing treatments that can stop it and potential prevent it altogether."" The study showed nearly everybody tested had alpha-synuclein protein in their the appendix.  And there were some differences in the structure of the protein between healthy people and Parkinson's patients.  But the hunt for the origins of Parkinson's still cannot explain why the disease develops in some people but not others.  This field of research is asking as many new questions as it answers.  Follow James on Twitter."
46,Facebook daily visits growth slows as sales miss forecasts - BBC News,http://www.bbc.com///news/business-46038496,2018-10-31 11:02:53,Business,http://www.bbc.com///news/business,"Facebook's user growth has slowed and its revenue has missed forecasts, according to the firm's latest results. An average of 1.49 billion people used Facebook's social network on a daily basis in September, up 9% on last year but below expectations of 1.51 billion. Growth was flat in the US and Canada and fell in Europe. Facebook said sales rose by 33% to $13.7bn (£10.7bn) in the third quarter, but fell short of expectations and trailed the prior quarter's 42% gain. The company, which also owns WhatsApp and Instagram, is grappling with a shift in its business as user growth slows in its most profitable markets. Growth is stalling in developed markets while an increasing amount of activity is happening via private messages or temporary ""stories"". The firm is yet to turn those features into an advertising business on the same level as the newsfeed on its original Facebook network. Mark Zuckerberg, co-founder and chief executive of Facebook, said he is confident that the company's advertising sales will catch up to the change in users' behaviour. However, he warned investors that 2019 would be another year of ""significant investment"". ""It will take some time,"" he said.  Facebook, which has been hit by data breaches and concerns about ""fake news"", told investors in July that growth would slow. It cited the shift in users and its own increased spending on security and privacy. During the third quarter to 30 September, Facebook said India, Indonesia and the Philippines showed the strongest gains in users. It also said that expenses increased 53% year-on-year to $7.9bn. Facebook expects revenue growth to continue to decelerate and costs to grow between 40% and 50% in 2019.  Mr Zuckerberg said expenses should begin to moderate after that but cautioned that investments in anti-hacking and abuse efforts will continue. ""I do think we are up against sophisticated adversaries who will continue to evolve so there is a large element of this that is an arms race,"" he said. ""These are not problems that you fix. These are problems that you manage over time."" Profits in the third quarter were $5.1bn, up 9% due in part to a lower-than-expected tax rate."
47,Hawaii top court approves controversial Thirty Meter Telescope - BBC News,http://www.bbc.com///news/world-us-canada-46046864,2018-11-01 02:55:59,US & Canada,http://www.bbc.com///news/world/us_and_canada,"Hawaii's Supreme Court has approved construction of what will be one of the world's largest single telescopes, on the controversial site of Mauna Kea. Work on the $1.4bn (£1bn) Thirty Meter Telescope (TMT) had paused in 2015 after protests from some native Hawaiians, to whom the land is sacred. The state's top court ruled 4-1 in favour of the scientists on Tuesday. Mauna Kea already has 13 telescopes; activists say their construction has interfered with cultural practices. For years, protesters - including some environmentalists - have said building what is planned to be the world's biggest telescope on a site already saturated with observatories would further desecrate and pollute the sacred mountain. On Tuesday, Hawaii's Governor David Ige thanked the top court for its ruling in a statement, saying he believes the decision is ""fair"".  ""We're pleased the court carefully considered and weighed all the varied and passionate testimony about TMT,"" he said.  ""We believe this decision is fair and right and will continue to keep Hawai'i at the forefront of astronomy."" KAHEA, a Hawaiian-environmental group involved in the case, said they were ""disappointed"" by the decision as it ""wrongly relies"" on assumptions that there is no evidence of cultural practices on the land. The TMT is a joint effort between scientific institutions in the US, Canada, China, Japan and India. Mauna Kea, located on Hawaii's Big Island, is managed by the University of Hawaii. There are currently no legal limits to telescope construction on the site. But protests erupted when TMT construction was to begin. In April 2015, protesters blocked access roads to prevent crews from accessing the site and were arrested. Game of Thrones actor Jason Momoa, who is of Hawaiian descent, was among those speaking out against construction.  That year, the state's Supreme Court rescinded the 2011 building permit as it had been issued without letting opponents state their case. In 2016, TMT's board suggested that they might move the project to the Canary Islands, Spain, instead, but last year, Hawaii's Board of Land and Natural Resources approved a new permit. The  Office of Hawaiian Affairs (OHA), an agency that handles native issues, also issued a civil complaint against the university, the land board and the telescope board. The complaint said the university ""failed to meet its responsibilities"". ""At the expense of the mountain's pristine environment and cultural significance, [the university] has chosen to aggressively develop the summit of Mauna Kea for the benefit of astronomical institutions around the world."" But Tuesday's Supreme Court ruling has upheld the new permit.  Construction on the telescope can now legally proceed, though the decision also mandates that the state ensure attention is paid to cultural protocols. Henry Yang, chair of the TMT international board, said in a statement that his group was ""grateful"" and would ""honour"" Hawaii's culture. Opposition to construction in general atop Mauna Kea has existed for decades as many indigenous Hawaiians consider it the most sacred mountain. But for scientists, cloud-free skies, low atmospheric water vapour and other conditions make it among the best sites in the world for astronomy. Mauna Kea is technically ""ceded land"", the legal term for native Hawaiian lands that indigenous leaders relinquished to the US when the territory was forcibly annexed.  The plans for the telescope include, unsurprisingly, a 30m-wide mirror, making it three times as wide as the largest currently existing visible-light telescope in the world. Using the TMT, astronomers hope to investigate the universe's ""dark ages"", when the first sources of light were created, galaxies and black holes, as well as planet formation. According to the group, the telescope ""will be the largest ground-based observatory in the world and will provide new observational opportunities in essentially every field of astronomy and astrophysics"".  "
48,Britain's hidden heroines - BBC News,http://www.bbc.com///news/in-pictures-45957783,2018-10-30 12:14:23,In Pictures,http://www.bbc.com///news/in_pictures,"The 1953 East Coast floods devastated coastal communities. In England, 307 people were killed in the counties of Lincolnshire, Norfolk, Suffolk and Essex, 19 died in Scotland and around 32,000 people were evacuated. Sea defences around the country had to be rebuilt and the WVS were on hand as always to provide food and care to workers in remote areas."
